{
  "schema_version": "pgworkbench.scenario-pack/v1",
  "id": "postgres-experiment-workbench-builtin",
  "version": "0.2.3",
  "engine_constraint": ">=0.2.0",
  "description": "Built-in disposable PostgreSQL engineering scenarios.",
  "assets": [
    ".env.example",
    ".go-version",
    "CHANGELOG.md",
    "LICENSE",
    "Makefile",
    "NOTICE",
    "README.md",
    "compose.yaml",
    "compatibility",
    "benchmarks",
    "configs",
    "cmd",
    "datasets",
    "docs",
    "evidence",
    "experiments",
    "go.mod",
    "go.sum",
    "internal",
    "matrices",
    "patchsets",
    "profiles",
    "schemas",
    "scripts",
    "sql",
    "topologies",
    "tests",
    "third_party",
    "utility-suites",
    "utility-tests",
    "workloads"
  ]
}
